{
  "schema_version": 1,
  "title": "WiFi-Bridge видит адаптер, но программа не подключается: проверьте COM-пару",
  "description": "Как различить подключение к WiFi, работу WiFi-Bridge и ошибку выбора концов виртуальной COM-пары. Без прошивки ЭБУ и отключения защиты ПК.",
  "summary": "WiFi-Bridge и программа для ЭБУ должны использовать разные концы одной виртуальной COM-пары. Если обеим программам назначен один порт, соединение через мост не получится. Проверять это имеет смысл после того, как WiFi-Bridge уже видит сам адаптер.",
  "summary_claim_ids": ["pair", "network"],
  "sections": [
    {
      "role": "scope",
      "heading": "Когда эта проверка уместна",
      "text": "Сценарий относится к работе с адаптером MAD-auto через WiFi-Bridge и программой для ЭБУ, которая использует виртуальный COM-порт. Подключение к беспроводной сети само по себе не подтверждает, что вся цепочка обмена настроена.\n\nМатериал объясняет устройство соединения. Версии вашего ЭБУ, прошивки адаптера и программы необходимо сверить отдельно.",
      "claim_ids": ["pair", "network"]
    },
    {
      "role": "requirements",
      "heading": "Что понадобится",
      "text": "Нужны подключённый адаптер, WiFi-Bridge, уже созданная пара виртуальных COM-портов и программа, совместимая с выбранным протоколом ЭБУ. Используйте законно установленный драйвер виртуальных портов. Этот материал не требует изменения прошивки или электрического подключения ЭБУ.",
      "claim_ids": ["pair"]
    },
    {
      "role": "steps",
      "heading": "Проверьте цепочку по порядку",
      "text": "1. Посмотрите, установил ли WiFi-Bridge связь с самим адаптером. Если нет, переходите к отдельной проверке подключения из FAQ.\n2. Найдите в настройках установленного драйвера пару виртуальных портов и запишите оба её конца. Важно определить именно пару, а не два произвольных номера.\n3. Сверьте, какой конец выбран в WiFi-Bridge.\n4. В программе для ЭБУ выберите другой конец той же пары. Не назначайте обеим программам один и тот же порт.\n5. Проверьте соответствие режима обмена и программы используемому ЭБУ по документации, затем повторите штатное подключение.",
      "claim_ids": ["pair", "network"]
    },
    {
      "role": "result",
      "heading": "Как понять результат",
      "text": "После проверки каждой программе назначен свой конец одной пары: WiFi-Bridge находится с одной стороны моста, программа для ЭБУ — с другой. Это устраняет конкретную ошибку выбора одинакового конца. Само по себе такое назначение не доказывает правильность протокола и не гарантирует связь с любым ЭБУ.",
      "claim_ids": ["pair"]
    },
    {
      "role": "troubleshooting",
      "heading": "Если подключение всё ещё не установлено",
      "text": "Разделите два случая. Если WiFi-Bridge не видит адаптер, проблема ещё находится на стороне его соединения с устройством; начните с соответствующего раздела FAQ. Если адаптер виден, но программа для ЭБУ не работает, повторно сверьте пару портов и выбранный протокол.\n\nНе заменяйте проверку обещанием, что любой OBD-адаптер работает с любой программой. Документация MAD-auto прямо отделяет этот способ обмена от ELM327 и J2534.",
      "claim_ids": ["pair", "network"]
    },
    {
      "role": "limitations",
      "heading": "Что эта инструкция не подтверждает",
      "text": "Здесь нет испытания конкретной машины, рекомендации по записи программного обеспечения ЭБУ или полной матрицы совместимости. Если ваша версия программы, ЭБУ или адаптера не отражена в актуальной документации, перед практическими действиями уточните применимость у поддержки.",
      "claim_ids": ["pair"]
    }
  ],
  "visuals": [],
  "author": {"name": "", "url": ""},
  "date_published": null,
  "date_modified": null,
  "cta": "Для обращения в поддержку подготовьте названия ЭБУ и программы, версии ПО и описание того, на каком звене пропадает связь. На публичном снимке скройте серийный номер и другие данные владельца."
}
